[
  {
    "suiteId": "libreoffice",
    "suiteName": "LibreOffice",
    "mainAppId": "libreoffice",
    "components": [
      {
        "appId": "deb-debian:libreoffice-writer",
        "name": "LibreOffice Writer"
      },
      {
        "appId": "deb-debian:libreoffice-calc",
        "name": "LibreOffice Calc"
      },
      {
        "appId": "deb-debian:libreoffice-impress",
        "name": "LibreOffice Impress"
      },
      {
        "appId": "deb-debian:libreoffice-draw",
        "name": "LibreOffice Draw"
      },
      {
        "appId": "deb-debian:libreoffice-base",
        "name": "LibreOffice Base"
      }
    ],
    "reason": "Verified against the real merged catalog (2026-08-20): each component ships as its own independently-installable package on Debian/Ubuntu/Fedora, while Flathub bundles the whole suite into one flatpak (which the match tiers already correctly group alongside deb/Fedora's own bare libreoffice metapackage, via exact normalized-name matching)."
  },
  {
    "suiteId": "calligra",
    "suiteName": "Calligra",
    "mainAppId": "org.kde.calligra",
    "components": [
      {
        "appId": "deb-debian:calligrawords",
        "name": "Calligra Words"
      },
      {
        "appId": "deb-debian:calligrasheets",
        "name": "Calligra Sheets"
      },
      {
        "appId": "deb-debian:calligrastage",
        "name": "Calligra Stage"
      },
      {
        "appId": "deb-debian:calligraplan",
        "name": "Calligra Plan"
      },
      {
        "appId": "rpm-fedora:calligra-karbon",
        "name": "Calligra Karbon"
      }
    ],
    "reason": "Same shape as LibreOffice. Deliberately narrower than every calligra-named package in the real catalog: Void Linux fragments Calligra into many packaging artifacts (32-bit variants, -devtools, -handbook, -libs, -plugins, -extras, -data subpackages) that fail the keep.ndjson litmus test (a user wouldn't launch these on their own) and are excluded from this list; dev.geopjr.Calligraphy is a genuinely different, unrelated calligraphy-practice app that happens to share the name prefix and must never be confused with this suite."
  },
  {
    "suiteId": "zen-browser",
    "suiteName": "Zen Browser",
    "mainAppId": "zen-browser-snap",
    "components": [
      {
        "appId": "pacman-aur:zen-browser-bitwarden",
        "name": "Zen Browser: Bitwarden"
      },
      {
        "appId": "pacman-aur:zen-browser-dark-reader",
        "name": "Zen Browser: Dark Reader"
      },
      {
        "appId": "pacman-aur:zen-browser-single-file",
        "name": "Zen Browser: SingleFile"
      },
      {
        "appId": "pacman-aur:zen-browser-sponsorblock",
        "name": "Zen Browser: SponsorBlock"
      },
      {
        "appId": "pacman-aur:zen-browser-ublock-origin",
        "name": "Zen Browser: uBlock Origin"
      },
      {
        "appId": "pacman-aur:zen-browser-url-to-desktop",
        "name": "Zen Browser: URL to Desktop"
      },
      {
        "appId": "pacman-aur:zen-browser-violentmonkey",
        "name": "Zen Browser: Violentmonkey"
      }
    ],
    "reason": "User-reported: these are browser extensions bundled/packaged for Zen specifically (AUR-only, zen-browser-<extension> naming), not standalone apps -- same shape as LibreOffice/Calligra (a main app plus separately-installable components), not filter/rules.ts noise, since a user might genuinely search for a Zen Browser extension by name and should land on the real Zen Browser app rather than nothing. zen-browser-twilight-bin deliberately excluded -- Twilight is a distinctly branded separate release channel (Zen's nightly/beta), not an extension, and not conflated with stable Zen here."
  }
]
